name,category,price,sizes,description,images,amazon_url
Royal Kanjivaram Silk Saree,Sarees,4999,Free Size,"A timeless Kanjivaram silk saree in deep maroon with a contrast gold zari border and a richly woven pallu. Comes with an unstitched blouse piece. Perfect for weddings and festive occasions.",saree-kanjivaram-1.svg|saree-kanjivaram-2.svg,
Banarasi Silk Saree,Sarees,6499,Free Size,"Handwoven Banarasi silk in regal indigo with intricate gold brocade motifs across the body and an opulent pallu. A heirloom-worthy drape with an unstitched blouse piece included.",saree-banarasi-1.svg|saree-banarasi-2.svg,
Chanderi Cotton Saree,Sarees,2799,Free Size,"Lightweight Chanderi cotton-silk saree in emerald green with a subtle shimmer and delicate gold border. Breathable and elegant — ideal for daytime functions and office festivities.",saree-chanderi-1.svg,
Embroidered Anarkali Kurti,Kurtis,1499,S|M|L|XL,"Flowing mustard Anarkali kurti with fine thread embroidery on the yoke and a flared silhouette that flatters every figure. Pairs beautifully with leggings or palazzos.",kurti-anarkali-1.svg,
Straight Cotton Kurti,Kurtis,999,S:no|M:no|L:no|XL:no,"Easy everyday straight-cut kurti in soft teal cotton with a clean neckline and side slits. A versatile wardrobe staple for work and home.",kurti-straight-1.svg,
A-Line Embroidered Kurti,Kurtis,1799,S|M:no|L|XL,"Wine-toned A-line kurti with gold mirror-work detailing along the neckline and hem. A festive-ready piece that transitions effortlessly from celebrations to evenings out.",kurti-aline-1.svg,
